{
  "video_id": "ad1",
  "creative_signal_only": true,
  "cold_watch": {
    "immediate_felt_reaction": "The opening feels like a fast kitchen-table diagnosis: the creator turns not eating greens into concrete daily symptoms with labeled cups and a direct headline (ev_keyframe_001, ev_ocr_001).",
    "moment_of_curiosity": "Curiosity peaks when each symptom cup gets mapped to a nutrient in red overlays, starting with the 'Can't poop?' to zinc pairing and continuing through energy, brain fog, and body aches (ev_keyframe_002, ev_keyframe_008, ev_keyframe_011).",
    "moment_of_confusion_or_boredom": "The weakest early moment is the long symptom-to-nutrient sequence, because several health associations are asserted quickly without substantiation beyond the creator's props and overlays (ev_keyframe_002, ev_keyframe_005, ev_keyframe_008, ev_keyframe_009, ev_keyframe_011).",
    "most_memorable_image": "The most memorable image is the row of plastic cups with sticky-note symptoms, followed by the Gruns packet being positioned as the item that contains the listed vitamins and minerals (ev_keyframe_001, ev_keyframe_012, ev_keyframe_014)."
  },
  "evidence_timeline": [
    {
      "time": "0.000-0.500",
      "observation": "The creator stands in a kitchen behind five clear cups labeled with symptom notes; the top caption says 'If you don't eat your GREENS..' and the first cup reads 'CAN'T POOP?'. A red overlay maps 'Can't [poop]?' to 'Zinc'.",
      "viewer_perception": "The viewer is pushed into a quick self-check: the ad reframes a vague nutrition habit as a list of embarrassing or uncomfortable daily problems.",
      "mechanism": "symptom-led hook",
      "evidence_ids": ["ev_keyframe_001", "ev_ocr_001", "ev_keyframe_002", "ev_ocr_002"],
      "confidence": "high"
    },
    {
      "time": "2.000-8.070",
      "observation": "The creator repeats the cup reveal pattern: 'Feeling sick?' maps to vitamin A and C, 'Low energy?' maps to iron, 'Brain fog?' maps to vitamin E, and 'Body aches?' maps to niacin/niacine in red overlays.",
      "viewer_perception": "The repetition turns scattered symptoms into a checklist, making the viewer wait for their own problem to appear.",
      "mechanism": "diagnostic ladder",
      "evidence_ids": ["ev_keyframe_005", "ev_ocr_005", "ev_keyframe_008", "ev_keyframe_009", "ev_keyframe_011", "ev_ocr_011"],
      "confidence": "high"
    },
    {
      "time": "9.415-12.105",
      "observation": "The camera switches to handheld product footage near the cups and a Gruns packet; captions say 'if you guys didn't know' and 'these Gruns gummies have all those vitamins and minerals I just listed' while the bag's supplement facts panel is shown.",
      "viewer_perception": "The ad tries to convert the symptom checklist into a bundled-product answer, using the product label as a proof cue.",
      "mechanism": "bundle proof pivot",
      "evidence_ids": ["ev_keyframe_012", "ev_ocr_012", "ev_keyframe_013", "ev_keyframe_014", "ev_ocr_014"],
      "confidence": "medium"
    },
    {
      "time": "13.450-16.140",
      "observation": "The creator holds a Gruns daily packet close to camera while captions say it 'actually tastes really good,' is 'easy to eat,' and that 'you and your kids will enjoy them'.",
      "viewer_perception": "After the health-problem setup, the ad reduces usage friction by promising taste, ease, and family acceptance.",
      "mechanism": "friction reducer",
      "evidence_ids": ["ev_keyframe_015", "ev_keyframe_016", "ev_ocr_016", "ev_keyframe_017", "ev_ocr_017"],
      "confidence": "high"
    },
    {
      "time": "17.485-20.175",
      "observation": "The creator opens a large Gruns bag full of small packets; captions say 'if you wanna grab yourself this huge bag,' 'that comes with 28 of these small packs,' and 'I put a link right here for you'.",
      "viewer_perception": "The product moves from health answer to tangible purchase unit: a big bag, many daily packs, and a direct link cue.",
      "mechanism": "package-value and link transition",
      "evidence_ids": ["ev_keyframe_018", "ev_ocr_018", "ev_keyframe_019", "ev_keyframe_020", "ev_ocr_020"],
      "confidence": "high"
    },
    {
      "time": "21.520-25.555",
      "observation": "The creator returns to a close-up with several packets and captions say there is a 'massive sale,' it 'ends in a couple days,' the product has been 'selling out like crazy,' and viewers should 'try to get them if you can'.",
      "viewer_perception": "The ad closes with scarcity and urgency, but the sale and sell-out claims are not independently proven in the video.",
      "mechanism": "urgency close",
      "evidence_ids": ["ev_keyframe_021", "ev_keyframe_022", "ev_ocr_022", "ev_keyframe_023", "ev_keyframe_024", "ev_ocr_024"],
      "confidence": "high"
    }
  ],
  "core_mechanism": {
    "name": "symptom checklist to bundled supplement answer",
    "why_it_catches_attention": "It opens with a direct, slightly provocative greens headline and immediately turns nutrition avoidance into visible symptom props on a kitchen counter.",
    "why_it_might_persuade": "It gives viewers a simple ladder: recognize a symptom, see a nutrient association, then see a single product framed as containing the listed vitamins and minerals.",
    "what_cannot_be_copied": "Do not copy the Gruns brand, health claims, symptom-to-nutrient mappings, creator likeness, kitchen setup, captions, music, sale language, or scarcity claims."
  },
  "creative_intent": {
    "creative_label": "Gruns Symptom-Ladder UGC Ad",
    "creative_type": "UGC / creator testimonial / direct-response supplement offer",
    "likely_hypothesis": "If viewers connect skipped greens with common discomforts, one daily packet will feel like a convenient fix and increase click or purchase intent.",
    "target_audience": "Health-curious, convenience-seeking adults or parents who know they should eat greens but do not consistently do it.",
    "awareness_stage": "Problem-aware to solution-aware.",
    "funnel_stage": "Cold prospecting direct-response creative with conversion intent.",
    "likely_kpi": "Click-through, offer-page visits, first purchase, CAC, and ROAS.",
    "offer_strategy": "Use a symptom self-check to create personal relevance, then use product proof and sale urgency to push action.",
    "marketer_job_to_be_done": "Turn a vague nutrition habit into an urgent, personal reason to try a convenient supplement pack.",
    "evidence_ids": ["ev_keyframe_001", "ev_keyframe_012", "ev_keyframe_020", "ev_keyframe_024"],
    "confidence": "medium",
    "unknowns": [
      "No media-buy targeting, landing-page analytics, spend, CAC, ROAS, or conversion data were provided.",
      "The report infers funnel and KPI from visible creative signals only."
    ]
  },
  "distilled_core": {
    "core_thesis": "The creative converts a vague greens habit into a symptom checklist, then positions one packet as the convenient bundled answer.",
    "mechanism_formula": "greens neglect -> symptom self-check -> nutrient mapping -> packet proof -> taste/ease reassurance -> scarcity CTA",
    "belief_shift_summary": "The viewer is moved from 'greens are optional' to 'my daily discomforts might be solvable through one easy supplement routine.'",
    "why_it_works": "It uses self-diagnosis and visible props to make an abstract nutrition promise feel immediate, personal, and easy to act on.",
    "where_it_breaks": "The proof is thin because symptom-to-nutrient links, family acceptance, sale urgency, and sell-out claims are asserted rather than verified.",
    "submagic_transfer": "Translate the structure into creator-workflow pain: labeled editing bottlenecks become a visible Submagic feature ladder and proof scene.",
    "steal": [
      "Open with a concrete self-check instead of a generic product promise.",
      "Use repeated physical labels to make invisible pain feel inspectable.",
      "Bridge from pain to product with a clear bundled-solution moment."
    ],
    "avoid": [
      "Do not borrow the brand, health claims, creator identity, captions, or scarcity language.",
      "Do not make unsupported performance or outcome claims.",
      "Do not let the diagnostic ladder run longer than the proof can support."
    ],
    "test_next": [
      "Test a shorter three-problem ladder against the full five-problem ladder.",
      "Test putting the product proof before the fourth symptom card.",
      "Test verified social proof instead of unverified sell-out urgency."
    ]
  },
  "core_understanding": {
    "human_truth": "People often know they should eat better, but they respond faster when a broad health habit is connected to a specific annoyance they already feel.",
    "belief_shift": {
      "before": "Not eating greens is a vague wellness miss that can be postponed.",
      "after": "Not eating greens may be tied to concrete discomforts, and one easy daily packet may cover the nutrients the viewer is missing.",
      "bridge": "The ad bridges the gap with sticky-note symptom props, fast nutrient overlays, visible product packaging, and a scarcity CTA."
    },
    "tension_stack": [
      "Fear: the viewer may recognize one of the symptom labels and feel they are neglecting a basic health habit (ev_keyframe_001, ev_keyframe_005, ev_keyframe_008, ev_keyframe_011).",
      "Desire: the viewer wants a simpler routine than cooking or consistently eating greens (ev_keyframe_016, ev_ocr_016).",
      "Objection: supplements can taste bad or be hard for a family to adopt, so the creator claims taste, ease, and kid acceptance (ev_keyframe_015, ev_keyframe_017).",
      "Proof need: the product must plausibly contain the listed nutrients, so the bag and supplement facts panel are shown, though the label is not fully legible (ev_keyframe_013, ev_keyframe_014).",